<deegreeOAF configVersion="3.4.0"
            xmlns="http://www.deegree.org/services/oaf"
            xmlns:xsi="http://www.w3.org/2001/XMLSchema-instance"
            xsi:schemaLocation="http://www.deegree.org/services/oaf oaf_configuration.xsd">

  <FeatureStoreId>test</FeatureStoreId>

  <!-- First CRS must be http://www.opengis.net/def/crs/OGC/1.3/CRS84 to be conform to OGC API Features Core -->
  <QueryCRS>http://www.opengis.net/def/crs/OGC/1.3/CRS84</QueryCRS>
  <QueryCRS>EPSG:4326</QueryCRS>
  <QueryCRS>EPSG:25832</QueryCRS>

  <DateTimeProperties>
    <DateTimeProperty>
      <FeatureTypeName xmlns:app="http://www.deegree.org/app">app:FeatureType</FeatureTypeName>
      <PropertyName xmlns:app="http://www.deegree.org/app">app:datetime</PropertyName>
    </DateTimeProperty>
  </DateTimeProperties>

  <ServiceMetadata>
    <MetadataURL format="application/xml">http://metaver?service=CSW&amp;request=GetRecordById&amp;version=2.0.2&amp;id=89362</MetadataURL>
    <MetadataURL format="text/html">http://localhost:8080/linkZuHTml/89362</MetadataURL>
  </ServiceMetadata>

</deegreeOAF>